{
  "schema_version": "1.0",
  "product_goals": [
    {
      "text": "Принимать заявки на ремонт оборудования.",
      "evidence": [
        {
          "source": "requirements",
          "quote": "Сотрудник подаёт заявку на ремонт оборудования.",
          "question_id": null
        }
      ]
    }
  ],
  "in_scope": [
    {
      "text": "Подача заявок, просмотр и изменение статуса.",
      "evidence": [
        {
          "source": "requirements",
          "quote": "Сотрудник подаёт заявку на ремонт оборудования.",
          "question_id": null
        },
        {
          "source": "requirements",
          "quote": "Диспетчер видит заявки и меняет статус.",
          "question_id": null
        }
      ]
    }
  ],
  "out_of_scope": [
    {
      "text": "Реальные внешние интеграции.",
      "evidence": [
        {
          "source": "requirements",
          "quote": "Реальные внешние интеграции не требуются.",
          "question_id": null
        }
      ]
    }
  ],
  "roles": [
    {
      "id": "ROLE-001",
      "text": "Сотрудник",
      "permissions": [
        "Создание заявки",
        "Просмотр своих заявок"
      ],
      "evidence": [
        {
          "source": "requirements",
          "quote": "Сотрудник подаёт заявку на ремонт оборудования.",
          "question_id": null
        },
        {
          "source": "requirements",
          "quote": "Сотрудник видит свои заявки и их статус.",
          "question_id": null
        }
      ]
    },
    {
      "id": "ROLE-002",
      "text": "Диспетчер",
      "permissions": [
        "Просмотр заявок",
        "Изменение статуса"
      ],
      "evidence": [
        {
          "source": "requirements",
          "quote": "Диспетчер видит заявки и меняет статус.",
          "question_id": null
        }
      ]
    }
  ],
  "functional_requirements": [
    {
      "id": "FR-001",
      "text": "Сотрудник подаёт заявку с описанием неисправности.",
      "evidence": [
        {
          "source": "requirements",
          "quote": "Сотрудник подаёт заявку на ремонт оборудования. Заявка содержит описание неисправности.",
          "question_id": null
        }
      ]
    },
    {
      "id": "FR-002",
      "text": "Сотрудник просматривает собственные заявки и их статусы.",
      "evidence": [
        {
          "source": "requirements",
          "quote": "Сотрудник видит свои заявки и их статус.",
          "question_id": null
        }
      ]
    },
    {
      "id": "FR-003",
      "text": "Диспетчер просматривает заявки и меняет статус.",
      "evidence": [
        {
          "source": "requirements",
          "quote": "Диспетчер видит заявки и меняет статус.",
          "question_id": null
        }
      ]
    }
  ],
  "nonfunctional_requirements": [
    {
      "id": "NFR-001",
      "text": "Список заявок отображается не более чем за 2 секунды.",
      "verification": "Измерить время от запроса списка до отображения; порог — 2 секунды.",
      "evidence": [
        {
          "source": "requirements",
          "quote": "Список заявок отображается не более чем за 2 секунды.",
          "question_id": null
        }
      ]
    }
  ],
  "constraints": [
    {
      "text": "Реальные интеграции не нужны.",
      "evidence": [
        {
          "source": "requirements",
          "quote": "Реальные внешние интеграции не требуются.",
          "question_id": null
        }
      ]
    }
  ],
  "entities": [
    {
      "text": "Заявка: описание неисправности и статус.",
      "evidence": [
        {
          "source": "requirements",
          "quote": "Заявка содержит описание неисправности.",
          "question_id": null
        },
        {
          "source": "requirements",
          "quote": "Сотрудник видит свои заявки и их статус.",
          "question_id": null
        }
      ]
    }
  ],
  "scenarios": [
    {
      "id": "SC-001",
      "text": "Подача заявки",
      "role_ids": [
        "ROLE-001"
      ],
      "related_fr_ids": [
        "FR-001",
        "FR-002"
      ],
      "steps": [
        "Сотрудник вводит описание неисправности.",
        "Сотрудник подаёт заявку.",
        "Сотрудник открывает список своих заявок."
      ],
      "evidence": [
        {
          "source": "requirements",
          "quote": "Сотрудник подаёт заявку на ремонт оборудования.",
          "question_id": null
        },
        {
          "source": "requirements",
          "quote": "Сотрудник видит свои заявки и их статус.",
          "question_id": null
        }
      ]
    }
  ],
  "integrations": [],
  "security_requirements": [
    {
      "text": "Сотрудник просматривает только собственные заявки.",
      "evidence": [
        {
          "source": "requirements",
          "quote": "Сотрудник видит свои заявки и их статус.",
          "question_id": null
        }
      ]
    }
  ],
  "acceptance_criteria": [
    {
      "id": "AC-001",
      "related_fr_ids": [
        "FR-001"
      ],
      "given": "Сотрудник указал описание неисправности.",
      "when": "Он подаёт заявку.",
      "then": "Заявка сохраняется с указанным описанием."
    },
    {
      "id": "AC-002",
      "related_fr_ids": [
        "FR-002"
      ],
      "given": "Есть заявки двух сотрудников.",
      "when": "Первый сотрудник открывает свои заявки.",
      "then": "Он видит только свои заявки с текущими статусами."
    },
    {
      "id": "AC-003",
      "related_fr_ids": [
        "FR-003"
      ],
      "given": "Диспетчер открыл заявку.",
      "when": "Он меняет статус.",
      "then": "Новый статус сохраняется и виден сотруднику."
    }
  ],
  "risks": [
    {
      "id": "RISK-001",
      "text": "Не определены права удаления.",
      "impact": "Можно ошибочно разрешить необратимое удаление чужой заявки.",
      "related_fr_ids": [
        "FR-002",
        "FR-003"
      ]
    }
  ],
  "assumptions": [
    {
      "id": "ASM-001",
      "text": "Для первого прототипа достаточно списка и формы заявки.",
      "reason": "Вход не требует иных способов взаимодействия.",
      "related_fr_ids": [
        "FR-001",
        "FR-002"
      ]
    }
  ],
  "questions": [
    {
      "question_id": "c4f2de3a-29de-5e7d-a845-91de97bbcbf2",
      "reason": "Неопределённые права влияют на безопасность и сохранность заявок.",
      "related_fr_ids": [
        "FR-002",
        "FR-003"
      ],
      "required": true,
      "question": "Нужно ли удаление заявок и кому оно разрешено?"
    }
  ],
  "questions_revision": 1
}
