{"acceptance_criteria":[{"given":"Заявка сотрудника А в статусе draft.","id":"AC-001","related_fr_ids":["FR-001"],"then":"Статус становится cancelled.","when":"Сотрудник А отменяет заявку."},{"given":"Есть заявки двух сотрудников.","id":"AC-002","related_fr_ids":["FR-002"],"then":"Он видит только свои заявки с текущими статусами.","when":"Первый сотрудник открывает свои заявки."},{"given":"Диспетчер открыл заявку.","id":"AC-003","related_fr_ids":["FR-003"],"then":"Новый статус сохраняется и виден сотруднику.","when":"Он меняет статус."}],"assumptions":[{"id":"ASM-001","reason":"Вход не требует иных способов взаимодействия.","related_fr_ids":["FR-001","FR-002"],"text":"Для первого прототипа достаточно списка и формы заявки."}],"constraints":[{"evidence":[{"question_id":null,"quote":"Реальные внешние интеграции не требуются.","source":"requirements"}],"text":"Реальные интеграции не нужны."}],"entities":[{"evidence":[{"question_id":null,"quote":"Заявка содержит описание неисправности.","source":"requirements"},{"question_id":null,"quote":"Сотрудник видит свои заявки и их статус.","source":"requirements"}],"text":"Заявка: описание неисправности и статус."}],"functional_requirements":[{"evidence":[{"question_id":null,"quote":"Сотрудник подаёт заявку на ремонт оборудования. Заявка содержит описание неисправности.","source":"requirements"}],"id":"FR-001","text":"Сотрудник может отменить заявку в статусе draft."},{"evidence":[{"question_id":null,"quote":"Сотрудник видит свои заявки и их статус.","source":"requirements"}],"id":"FR-002","text":"Сотрудник просматривает собственные заявки и их статусы."},{"evidence":[{"question_id":null,"quote":"Диспетчер видит заявки и меняет статус.","source":"requirements"}],"id":"FR-003","text":"Диспетчер просматривает заявки и меняет статус."}],"in_scope":[{"evidence":[{"question_id":null,"quote":"Сотрудник подаёт заявку на ремонт оборудования.","source":"requirements"},{"question_id":null,"quote":"Диспетчер видит заявки и меняет статус.","source":"requirements"}],"text":"Подача заявок, просмотр и изменение статуса."}],"integrations":[],"nonfunctional_requirements":[{"evidence":[{"question_id":null,"quote":"Список заявок отображается не более чем за 2 секунды.","source":"requirements"}],"id":"NFR-001","text":"Список заявок отображается не более чем за 2 секунды.","verification":"Измерить время от запроса списка до отображения; порог — 2 секунды."}],"out_of_scope":[{"evidence":[{"question_id":null,"quote":"Реальные внешние интеграции не требуются.","source":"requirements"}],"text":"Реальные внешние интеграции."}],"product_goals":[{"evidence":[{"question_id":null,"quote":"Сотрудник подаёт заявку на ремонт оборудования.","source":"requirements"}],"text":"Принимать заявки на ремонт оборудования."}],"questions":[],"questions_revision":1,"risks":[{"id":"RISK-001","impact":"Можно ошибочно разрешить необратимое удаление чужой заявки.","related_fr_ids":["FR-002","FR-003"],"text":"Не определены права удаления."}],"roles":[{"evidence":[{"question_id":null,"quote":"Сотрудник подаёт заявку на ремонт оборудования.","source":"requirements"},{"question_id":null,"quote":"Сотрудник видит свои заявки и их статус.","source":"requirements"}],"id":"ROLE-001","permissions":["Создание заявки","Просмотр своих заявок"],"text":"Сотрудник"},{"evidence":[{"question_id":null,"quote":"Диспетчер видит заявки и меняет статус.","source":"requirements"}],"id":"ROLE-002","permissions":["Просмотр заявок","Изменение статуса"],"text":"Диспетчер"}],"scenarios":[{"evidence":[{"question_id":null,"quote":"Сотрудник подаёт заявку на ремонт оборудования.","source":"requirements"},{"question_id":null,"quote":"Сотрудник видит свои заявки и их статус.","source":"requirements"}],"id":"SC-001","related_fr_ids":["FR-001","FR-002"],"role_ids":["ROLE-001"],"steps":["Сотрудник вводит описание неисправности.","Сотрудник подаёт заявку.","Сотрудник открывает список своих заявок."],"text":"Подача заявки"}],"schema_version":"1.0","security_requirements":[{"evidence":[{"question_id":null,"quote":"Сотрудник видит свои заявки и их статус.","source":"requirements"}],"text":"Сотрудник просматривает только собственные заявки."}]}
